id,name,phone,about,headline,isApproved,country,city,state,zipCode,addressLineone,addressLinetwo,services_id,services_name,services_description,schoolName,programme,education_duration,education_description,companyName,position,workExperience_duration,job_description,achievements_description
P1044,Arjun Agarwal,6958271304,Experienced lawyer with a deep understanding of the legal system.,Lawyer,TRUE,Nepal,Anthonyhaven,Rhode Island,10932, Powell Track,Suite 295,1,Lawyer,Represents clients in legal proceedings.,Zenith College of Materials Science,LLB,5,foundation for a legal career with a comprehensive study of law.,Aether Innovations,Lawyer,5,Represents clients in legal proceedings.,"Successfully navigated complex legal negotiations, securing favorable terms for clients."
P1045,Vanya D'Souza,8214063957,Experienced business analyst with a passion for using data to drive business decisions.,Business Analyst,TRUE,Gambia,Stevenview,Rhode Island,27846, Derrick Fields Suite ,Suite 313,1,Business Analyst,Collaborates with stakeholders to gather requirements.,Opulent Institute of Finance,BA,3,Embark on a journey of intellectual exploration in the arts and humanities.,Virtuoso Dynamics,Business Analyst,3,Collaborates with stakeholders to gather requirements.,Received industry awards for outstanding contributions to business innovation.
P1046,Aditi Nair,3745698120,Dynamic marketing manager with a proven track record of success.,Marketing Manager,TRUE,French Southern Territories,Powellfurt,South Carolina,77073, Benjamin Terrace Suite ,Apt. 489,1,Marketing Manager,Manages marketing campaigns and promotional activities.,Frontier University of Political Economy,BBA,3,"Develop a comprehensive understanding of business principles, management practices, and entrepreneurship.",Harmony Ventures,Marketing Manager,2,Manages marketing campaigns and promotional activities.,"Successfully expanded market reach and penetration, contributing to increased sales and revenue."
P1047,Vihaan Jain,5091837462,Talented finance analyst with a keen eye for detail.,Finance Analyst,TRUE,British Virgin Islands,Lauraland,Wyoming,80444, Sherry Drive,Apt. 922,1,Finance Analyst,Provides insights for financial decision-making.,Utopia College of Communication,Btech,4,strong foundation in technology and engineering principles,Ethereal Innovations,Finance Analyst,11,Provides insights for financial decision-making.,Successfully managed investment portfolios that led to significant growth and positive returns.
P1048,Arya Iyer,2465381970,Dedicated teacher with a passion for education.,Teacher,TRUE,Saint Barthelemy,New Tammystad,Colorado,59324, Dillon Place Apt. ,Apt. 066,1,Teacher,Teaching,Epoch Polytechnic Institute,BA,3,Embark on a journey of intellectual exploration in the arts and humanities.,Opulent Enterprises,Teacher,4,Teaching,Received recognition for contributions to education through awards or commendations.
P1049,Advaita Ghosh,9876043215,Driven sales manager with a proven track record of exceeding quotas.,Sales Manager,TRUE,French Polynesia,Nicoleshire,North Carolina,29514, Gregory Brook Apt. ,Suite 415,1,Sales Manager,Sets sales targets and develops sales strategies.,Quantum University of Statistics,BA,3,Embark on a journey of intellectual exploration in the arts and humanities.,Cascade Dynamics,Sales Manager,5,Sets sales targets and develops sales strategies.,Received industry awards for excellence in sales and customer relationship management.
P1050,Aarush Kulkarni,1357924680,Experienced project manager with a knack for getting things done.,Project Manager,TRUE,Romania,Carlsonchester,Florida,58735, Megan Row Apt. ,Suite 829,1,Project Manager,Manages the development and lifecycle of a product.,Elysian State College,BBA,3,"Develop a comprehensive understanding of business principles, management practices, and entrepreneurship.",Utopia Innovations,Project Manager,8,Manages the development and lifecycle of a product.,Recognized for achieving high production output while maintaining quality standards.
